{
  "id": "Orc",
  "name": { "es": "Orcos", "en": "Orcs" },
  "speciesTag": "Orc",
  "styleTagWeights": { "Brute": 75, "Fine": 10, "Bulwark": 8, "Cold": 4, "Neutral": 3 },
  "launch": true,
  "cellsOccupied": 1,
  "bodyRadius": 38,
  "discipline": 45,
  "attributeBias": { "strength": 10, "speed": 0, "technique": -2, "stamina": 4, "leash": -12 },
  "ability": "hot_blooded",
  "description": { "es": "Fuerza bruta por delante de la técnica. Ganan el partido a base de contacto.", "en": "Brute strength over technique. They win matches through contact." },
  "individualDeviation": 9,
  "traitWeights": { "Aggressive": 25, "Fast": 6, "Scorer": 8, "LongShot": 6, "Cerebral": 3, "Dirty": 18, "Resilient": 14, "Coward": 2, "Leader": 8, "Lazy": 10 },
  "names": {
    "_doc": "Nombres de pila de fantasía: misma lista en los dos idiomas (docs/estilo-descripciones.md). Apellidos parlantes: equivalente del mismo registro, no traducción literal (Rompehuesos -> Bonebreaker).",
    "first": {
      "es": ["Grok", "Urzag", "Morg", "Thrak", "Bolg", "Gashk", "Ruk", "Zog", "Drog", "Krum", "Snaga", "Urk", "Ghash", "Lurtz", "Muzgash", "Naz", "Ogrim", "Rukh", "Shagrat", "Yagul", "Brakka", "Gorza", "Mazka", "Ulga", "Zurka", "Hrakka", "Nargla", "Torka"],
      "en": ["Grok", "Urzag", "Morg", "Thrak", "Bolg", "Gashk", "Ruk", "Zog", "Drog", "Krum", "Snaga", "Urk", "Ghash", "Lurtz", "Muzgash", "Naz", "Ogrim", "Rukh", "Shagrat", "Yagul", "Brakka", "Gorza", "Mazka", "Ulga", "Zurka", "Hrakka", "Nargla", "Torka"]
    },
    "last": {
      "es": ["Rompehuesos", "Comecráneos", "Piedraroja", "Mascadientes", "Tragaclavos", "Matabueyes", "Partecuellos", "Muerdehierro", "Sangrefría", "Pisacráneos", "Quiebraespinas", "Zampalobos"],
      "en": ["Bonebreaker", "Skulleater", "Redstone", "Toothgrinder", "Spikeswallower", "Oxslayer", "Neckbreaker", "Ironbiter", "Coldblood", "Skullstomper", "Spinecracker", "Wolfeater"]
    }
  }
}
