{
  "id": "Undead",
  "name": {
    "es": "No-muertos",
    "en": "Undead"
  },
  "speciesTag": "Undead",
  "styleTagWeights": {
    "Cold": 67,
    "Brute": 12,
    "Fine": 8,
    "Bulwark": 8,
    "Neutral": 5
  },
  "launch": true,
  "cellsOccupied": 1,
  "bodyRadius": 28,
  "discipline": 65,
  "attributeBias": {
    "strength": 2,
    "speed": -4,
    "technique": 4,
    "stamina": 8,
    "leash": -10
  },
  "ability": "numb",
  "description": {
    "es": "No sienten dolor ni miedo. Lentos pero implacables, cuesta pararlos del todo.",
    "en": "They feel neither pain nor fear. Slow but relentless, hard to stop for good."
  },
  "individualDeviation": 8,
  "traitWeights": {
    "Aggressive": 6,
    "Fast": 4,
    "Scorer": 6,
    "LongShot": 8,
    "Cerebral": 14,
    "Dirty": 8,
    "Resilient": 24,
    "Coward": 2,
    "Leader": 10,
    "Lazy": 18
  },
  "names": {
    "_doc": "Nombres de pila de fantasía: misma lista en los dos idiomas (docs/estilo-descripciones.md). Apellidos parlantes: equivalente del mismo registro, no traducción literal (Huesoseco -> Drybone).",
    "first": {
      "es": [
        "Malachar",
        "Vex",
        "Orin",
        "Cael",
        "Draven",
        "Malric",
        "Sever",
        "Thane",
        "Cyrus",
        "Doran",
        "Ezren",
        "Grimm",
        "Ilan",
        "Kessel",
        "Loth",
        "Mordan",
        "Nex",
        "Osric",
        "Ravik",
        "Zael",
        "Ashka",
        "Corvina",
        "Elowyn",
        "Isolde",
        "Lyra",
        "Morwen",
        "Neris",
        "Ravena",
        "Selis",
        "Vesper"
      ],
      "en": [
        "Malachar",
        "Vex",
        "Orin",
        "Cael",
        "Draven",
        "Malric",
        "Sever",
        "Thane",
        "Cyrus",
        "Doran",
        "Ezren",
        "Grimm",
        "Ilan",
        "Kessel",
        "Loth",
        "Mordan",
        "Nex",
        "Osric",
        "Ravik",
        "Zael",
        "Ashka",
        "Corvina",
        "Elowyn",
        "Isolde",
        "Lyra",
        "Morwen",
        "Neris",
        "Ravena",
        "Selis",
        "Vesper"
      ]
    },
    "last": {
      "es": [
        "Huesoseco",
        "Sinaliento",
        "Cenizagrís",
        "Tumbafría",
        "Vozmuerta",
        "Osamenta",
        "Nochehueca",
        "Polvorento",
        "Sudariofrío",
        "Cripta"
      ],
      "en": [
        "Drybone",
        "Breathless",
        "Ashgrey",
        "Coldgrave",
        "Deadvoice",
        "Boneyard",
        "Hollownight",
        "Dustworn",
        "Coldshroud",
        "Crypt"
      ]
    }
  }
}
